{
  "academic_year": 2026,
  "catalogue_root_name": "data",
  "content_sha256": "5447d44bdb2f3dce5777f608a5feb8bcbf521f5083f634042cece0998df89176",
  "created_at": "2026-09-20T20:06:08+00:00",
  "created_by": "Pass 12 explicit qualification programme scope migration",
  "file_count": 22,
  "files": [
    {
      "path": "uct_commerce/courses.json",
      "sha256": "2ededb9a30da8821ea1ec01fe3f044eb2cc20ed8063484c95716fa6e73d855b8",
      "size": 426604
    },
    {
      "path": "uct_commerce/degree_requirements.json",
      "sha256": "925c980597317f31e2263cb17187f1192be5a9baa5561b4dce0efee4a3a56150",
      "size": 1661319
    },
    {
      "path": "uct_commerce/source_extraction/course_fact_conflicts.json",
      "sha256": "4621f341c00ef530c3fbfb51f100bee54abb2733bff8c7a12d31e4925f824bff",
      "size": 23311
    },
    {
      "path": "uct_commerce/source_extraction/programme_extraction_summary.json",
      "sha256": "422a359cb387b759585dda145d1becbb9e229e24ac24f302acae19752830cfe4",
      "size": 7785
    },
    {
      "path": "uct_ebe/courses.json",
      "sha256": "31c8a6a35667dbf1b5a2c49d291ded550267fac9b75e67874d06b37cfdad6a22",
      "size": 309002
    },
    {
      "path": "uct_ebe/degree_requirements.json",
      "sha256": "776ebf70bc51dabcd2f5cbc5725d8a114629a836e89c1c71cb3803c73eade0ae",
      "size": 163246
    },
    {
      "path": "uct_ebe/source_extraction/README.md",
      "sha256": "b233eca9df0880916dfec730f575faa0b0904d358db7218df0f0a2550b8f6ac3",
      "size": 556
    },
    {
      "path": "uct_ebe/source_extraction/course_descriptions.json",
      "sha256": "934c16d7c08557ad9e2ffa09a3f2f4458bb045e56c58893c8f440e67f99daba9",
      "size": 180290
    },
    {
      "path": "uct_ebe/source_extraction/programme_rows.json",
      "sha256": "f97f8fcc742f3cd81a8c875f166a618b6c02236fcd562ba9fa501e5ae01c343e",
      "size": 128452
    },
    {
      "path": "uct_health/courses.json",
      "sha256": "311cc1c146a01ec21cce5ff907c1555f2196c5d42ca2e11cdc3fac67d5735d1c",
      "size": 716138
    },
    {
      "path": "uct_health/degree_requirements.json",
      "sha256": "e513476692684ad3f36fb4509e19eabaa5efa0a1288d6b32345720cf8e83b05c",
      "size": 152154
    },
    {
      "path": "uct_health/source_extraction/course_descriptions.json",
      "sha256": "311cc1c146a01ec21cce5ff907c1555f2196c5d42ca2e11cdc3fac67d5735d1c",
      "size": 716138
    },
    {
      "path": "uct_health/source_extraction/equivalent_course_map.json",
      "sha256": "b6f826a1c9f5ff85c412e60db9d4a4064841ec101bac585d43e3c8e0896dc474",
      "size": 12242
    },
    {
      "path": "uct_humanities/courses.json",
      "sha256": "31f346b88d74de2c441134fab587d219bc8d3967230261edacf92b4b2018ac5e",
      "size": 726041
    },
    {
      "path": "uct_humanities/degree_requirements.json",
      "sha256": "fbe9e856ba69bad9902d4cca4ea7ad43ee297e992f8809af6388058e30572397",
      "size": 297923
    },
    {
      "path": "uct_humanities/music_pathways_2026.json",
      "sha256": "0a5e4fca50c468b812d5879228b10c8562a29fad55f69c2365584cab0663f10b",
      "size": 87641
    },
    {
      "path": "uct_humanities/structured_course_additions_2026.json",
      "sha256": "40f4bfbf954003bd3aba3bdf6b7aa2e836f342423d6b1f77be694214254d21c8",
      "size": 17682
    },
    {
      "path": "uct_law/courses.json",
      "sha256": "ed204ce442b51100fa4b598ae3f414491a2e4bff22d49e7e830e049ce8025dd8",
      "size": 421950
    },
    {
      "path": "uct_law/degree_requirements.json",
      "sha256": "c7e97c3a37649fc3ebfdbde01f64470d4bb3ee6d1d5aea7eb74b2c3b6409e15f",
      "size": 189402
    },
    {
      "path": "uct_science/courses.json",
      "sha256": "9337d765aa2b1bf6a80f446b3deca8c639cdb3d65dca37bfa8f0dca703b63229",
      "size": 331165
    },
    {
      "path": "uct_science/degree_requirements.json",
      "sha256": "2df39d5ded3e79a581c98751b249af1388666b816622c196514531ec6079b72e",
      "size": 208231
    },
    {
      "path": "uct_science/source_extraction/course_descriptions.json",
      "sha256": "9337d765aa2b1bf6a80f446b3deca8c639cdb3d65dca37bfa8f0dca703b63229",
      "size": 331165
    }
  ],
  "notes": [
    "This manifest records existing files without changing them.",
    "A matching manifest does not itself establish institutional authority."
  ],
  "release_id": "uct-2026-uploaded-baseline",
  "schema_version": 1,
  "source_status": "checksum_mismatch_unverified_source_archive",
  "state": "baseline"
}
